{
  "schema_version": "0.1",
  "scene_id": "session1_beach",
  "canvas": {"width": 512, "height": 288, "pixels_per_unit": 16},
  "layers": [
    {"id": "background", "asset_id": "beach_background", "sorting_order": 0, "position": {"x": 256, "y": 144}},
    {"id": "lighthouse", "asset_id": "lighthouse", "sorting_order": 10, "position": {"x": 112, "y": 168}},
    {"id": "pet", "asset_id": "pet", "sorting_order": 20, "position": {"x": 250, "y": 112}}
  ],
  "activity_zone": {
    "id": "beach_foreground", "type": "polygon",
    "points": [{"x": 48, "y": 48}, {"x": 464, "y": 48}, {"x": 464, "y": 160}, {"x": 48, "y": 160}]
  },
  "interactions": [
    {"id": "pet_wave", "kind": "pet_action", "anchor": {"x": 250, "y": 136}, "radius": 24}
  ],
  "build_slots": [
    {"id": "small_shelter", "position": {"x": 430, "y": 96}, "allowed_prefabs": ["small_shelter"]}
  ]
}
